<?xml version="1.0" encoding="UTF-8"?>
<schema xmlns="http://www.w3.org/2001/XMLSchema" targetNamespace="http://www.epam.training.by/classes"
	xmlns:tns="http://www.epam.training.by/classes" elementFormDefault="qualified">
	<element name="candies">
		<complexType>
			<sequence>
				<element name="candy" type="tns:Candy" maxOccurs="unbounded"
					minOccurs="1" />
			</sequence>
		</complexType>
	</element>
	<complexType name="Candy">
		<sequence>
			<element type="string" name="name" />
			<element type="nonNegativeInteger" name="energy" />
			<element name="ingredients" type="tns:Ingredients" />
			<element name="value">
				<complexType>
					<sequence>
						<element type="nonNegativeInteger" name="proteins" />
						<element type="nonNegativeInteger" name="fats" />
						<element type="nonNegativeInteger" name="carbohydrates" />
					</sequence>
				</complexType>
			</element>
			<element type="string" name="production" />
		</sequence>
		<attribute type="tns:Unique" name="id" use="required" />
		<attribute type="string" name="type" use="required" />
		<attribute type="string" name="filling" use="optional" />
	</complexType>
	<simpleType name="Unique">
		<restriction base="ID">
			<pattern value="([a-zA-Z])[0-9]{2,5}" />
		</restriction>
	</simpleType>
	<complexType name="Ingredients">
		<sequence>
			<element name="water">
				<simpleType>
					<restriction base="nonNegativeInteger">
						<maxInclusive value="1000" />
					</restriction>
				</simpleType>
			</element>
			<element type="nonNegativeInteger" name="sugar" />
			<element type="nonNegativeInteger" name="fructose" />
			<element name="chocolate-type" minOccurs="0">
				<simpleType>
					<restriction base="string">
						<enumeration value="white" />
						<enumeration value="milk" />
						<enumeration value="dark" />
					</restriction>
				</simpleType>
			</element>
			<element type="integer" name="vanilla" />
		</sequence>
	</complexType>
</schema>
